{
  "allowed_return_codes": [
    0
  ],
  "family_id": "dev_year_pivot_score",
  "hazards": [
    {
      "hazard_id": "H2",
      "observable": "output.dat:OUT-SCORE / source error outcome pending",
      "reachability_recipe_ids": [],
      "target": {
        "byte_end": 1270,
        "byte_start": 1222,
        "file": "changed.cbl",
        "line": 50
      }
    },
    {
      "hazard_id": "H7",
      "observable": "output.dat:OUT-SCORE / source error outcome pending",
      "reachability_recipe_ids": [],
      "target": {
        "byte_end": 1270,
        "byte_start": 1222,
        "file": "changed.cbl",
        "line": 50
      }
    }
  ],
  "input_fields_sha256": "4f5ba668081109d1e25bcc970a464535dfc55e00769e31c5333660e8d2036a9c",
  "loops": [],
  "manifest_version": 1,
  "output_fields_sha256": "a5ed1a165086563423e07e10ae8a126794f528b98c34860447fcacbaf090a310",
  "program_id": "year-pivot-score-03",
  "provenance_sha256": "f05ff57f4c3fdb26ec88443b7cb7982cc975a8c181d202dd86fcc1ac7bdc1142",
  "source_sha256": "fc2b0c37ac5affc44bab546b91bd100bb1925170a73edb257f2de6f68fabaa09",
  "split": "dev"
}
