{
  "allowed_return_codes": [
    0
  ],
  "family_id": "dev_status_two_read",
  "hazards": [
    {
      "hazard_id": "H3",
      "observable": "stdout:OUT-STATUS",
      "reachability_recipe_ids": [
        "status-two-read-03-original-loop-full-width",
        "status-two-read-03-original-loop-ordered",
        "status-two-read-03-original-verification-full-width",
        "status-two-read-03-original-verification-ordered"
      ],
      "target": {
        "byte_end": 1675,
        "byte_start": 1662,
        "file": "original.cbl",
        "line": 70
      }
    },
    {
      "hazard_id": "H6",
      "observable": "output.dat:OUT-TEXT",
      "reachability_recipe_ids": [
        "status-two-read-03-original-loop-full-width",
        "status-two-read-03-original-loop-ordered",
        "status-two-read-03-original-verification-full-width",
        "status-two-read-03-original-verification-ordered"
      ],
      "target": {
        "byte_end": 1591,
        "byte_start": 1567,
        "file": "original.cbl",
        "line": 67
      }
    }
  ],
  "input_fields_sha256": "3fde24b7fdd61f749e5b65c0680b016e22ad4c7cc0149d8704f202687cc71db9",
  "loops": [],
  "manifest_version": 1,
  "output_fields_sha256": "b671b31cfa7c12883bb10fbdc4075c27a39679b7c706779b3ba15dff1981c4f5",
  "program_id": "status-two-read-03",
  "provenance_sha256": "ad21761a2350894146df3f235b5f6a77fce55d1553f5e3d7c061de4fd0f1e5f1",
  "source_sha256": "07eb8ecc701827d06fdb48fbaeebe5e88b1520a8e38171462f3f3274c9bb5d2e",
  "split": "dev"
}
