{
  "allowed_return_codes": [
    0
  ],
  "family_id": "dev_status_fallback",
  "hazards": [
    {
      "hazard_id": "H3",
      "observable": "stdout:OUT-STATUS",
      "reachability_recipe_ids": [],
      "target": {
        "byte_end": 627,
        "byte_start": 608,
        "file": "changed.cbl",
        "line": 23
      }
    },
    {
      "hazard_id": "H6",
      "observable": "output.dat:OUT-TEXT",
      "reachability_recipe_ids": [],
      "target": {
        "byte_end": 733,
        "byte_start": 709,
        "file": "changed.cbl",
        "line": 28
      }
    }
  ],
  "input_fields_sha256": "880ba924eecb0ac83a107dcdf8f026e6328afd9a45a17f0992ea6a074083fcb9",
  "loops": [],
  "manifest_version": 1,
  "output_fields_sha256": "b96014e4562ab22a8c46d22adf1bd52379a49428c60353fe1638a0a8f7f2cede",
  "program_id": "status-fallback-02",
  "provenance_sha256": "acf7b2fa2e417239196722d5ad6578a2ee88bd9db4ecc2441d10ebe573db5e8b",
  "source_sha256": "072d105b2b2f781f03f56e2ed85242b2f162987e62ae0f20ec5bb09b897ba2eb",
  "split": "dev"
}
