{
  "allowed_return_codes": [
    0
  ],
  "family_id": "dev_year_pivot_score",
  "hazards": [
    {
      "hazard_id": "H2",
      "observable": "output.dat:OUT-SCORE / source error outcome pending",
      "reachability_recipe_ids": [],
      "target": {
        "byte_end": 1269,
        "byte_start": 1221,
        "file": "original.cbl",
        "line": 50
      }
    },
    {
      "hazard_id": "H7",
      "observable": "output.dat:OUT-SCORE / source error outcome pending",
      "reachability_recipe_ids": [],
      "target": {
        "byte_end": 1269,
        "byte_start": 1221,
        "file": "original.cbl",
        "line": 50
      }
    }
  ],
  "input_fields_sha256": "ac9816de4de236e771215fa88ad922688aea8adb3986db2f9bd442d613938743",
  "loops": [],
  "manifest_version": 1,
  "output_fields_sha256": "797b5a7bfeac43c7822bfbc825f8c4056e68f6cd8799a532cda201357a5c5cd0",
  "program_id": "year-pivot-score-02",
  "provenance_sha256": "5d3d0ee55a25af36ebff3b99b9606dd64dc992066a720398b33d3271264d71e4",
  "source_sha256": "d9e48f0ffb5ca7267d1826fc43f2ed6877161d1551d02fd8868efc7e2351ebeb",
  "split": "dev"
}
